<?xml version="1.0" encoding="UTF-8"?>
<simpsons xmlns:xsi="http://www.w3.org/2001/XMLSchema-instance" 
xsi:noNamespaceSchemaLocation="exLosSimpson2.xsd">
	 <localidad valor="Springfield" anioFundacion="1800"/>
	<pelicula> Estreno el dia 15-03-2012
		<titulo> Los Simpsons la pelicula </titulo>
	</pelicula>
	<creador bso="Danny Elfman"> Matt Groening</creador>
	<familia nombre="Simpsons">6</familia>
	<temporada>
		<temporada01/>
		<!-- <temporada02/>
		<temporada03/>  -->
	</temporada>
	<personajes>
		<Homer/>
		<Marge/>
		<Bart/>
		<Lisa/>
		<Maggie/>
		<Abuelo/>
	</personajes>
	<colorPersonajes principal="amarillo" rojo="120" verde="150" azul="130"/>
	<MongomeryBurns dni="47555143W" matricula="0001ABX" mac="14:e3:a5:35:87:ef" color="amarillo"/>
	<localidadesRivales>Sevilla New_York</localidadesRivales>
	<Barney bebidaDiaria="Cerveza" bebidaFavorita="Cerveza"/>
	<Apu fechaNacimiento="2018-12-05">
		<apodo>Apuchu</apodo>
	</Apu>
	<Manjula fechaNacimiento="2018-11-23" nacionalidad="India">
		<apodo>Manjuchu</apodo>
		<DiosPreferido>Shiva</DiosPreferido>
	</Manjula>
	<Hugo>
		<edad>8</edad>
		<ladoCicatriz>derecho</ladoCicatriz>
		<aficiones>coser pajaros</aficiones>
		<aficiones>correr</aficiones>
	</Hugo>
</simpsons>
